{"assets":[{"format":"otf","path":"dist/ExampleSans-Regular.otf","sha256":"aaaaaaaaaaaaaaaaaaaaaaaaaaaaaaaaaaaaaaaaaaaaaaaaaaaaaaaaaaaaaaaa","size_bytes":1000,"style":"normal","url":"https://raw.githubusercontent.com/example/family/0123456789abcdef0123456789abcdef01234567/dist/ExampleSans-Regular.otf","weight":400},{"format":"otf","path":"dist/ExampleSans-Italic.otf","sha256":"bbbbbbbbbbbbbbbbbbbbbbbbbbbbbbbbbbbbbbbbbbbbbbbbbbbbbbbbbbbbbbbb","size_bytes":1001,"style":"italic","url":"https://raw.githubusercontent.com/example/family/0123456789abcdef0123456789abcdef01234567/dist/ExampleSans-Italic.otf","weight":400}],"author":"Example Studio","display_name":"Example Sans","github":{"owner":"example","repo":"family","sha":"0123456789abcdef0123456789abcdef01234567"},"license":"OFL-1.1","manifest_url":"https://raw.githubusercontent.com/example/family/0123456789abcdef0123456789abcdef01234567/fontpub.json","package_id":"example/family","published_at":"2026-01-02T00:00:00Z","schema_version":"1","version":"1.2.3","version_key":"1.2.3"}
